Flight Number,Origin,Destination,Length of Flight hr's,Departure Date,Departure time,Seats Available,Adult Price Ticket,Child Price Ticket
AA01,Heathrow Airport (UK),Beijing Capital International Airport (China),11.5,24/03/2026,03:39,8,920,534
AB02,Gatwick Airport (UK),Indira Gandhi International Airport (India),9,22/11/2026,11:34,47,720,418
AC03,Manchester Airport (UK),Narita International Airport (Japan),13.5,23/12/2026,18:25,57,580,336
AD04,Birmingham Airport (UK),Incheon International Airport (South Korea),12.3,24/03/2026,07:20,33,984,571
AE05,Edinburgh Airport (UK),Suvarnabhumi Airport (Thailand),11,05/11/2025,19:37,44,880,510
AF06,Glasgow Airport (UK),Changi Airport (Singapore),14,06/10/2026,18:32,273,620,360
AG07,Luton Airport (UK),Kuala Lumpur International Airport (Malaysia),15,16/02/2026,00:29,347,700,406
AH08,Stansted Airport (UK),Soekarno–Hatta International Airport (Indonesia),12,30/11/2026,06:10,267,960,557
AI09,Bristol Airport (UK),Tan Son Nhat International Airport (Vietnam),14,01/11/2025,08:08,340,620,360
AJ10,Leeds Bradford Airport (UK),Dubai International Airport (UAE),6,31/10/2026,01:26,346,480,278
AK11,Newcastle Airport (UK),Frankfurt Airport (Germany),2,24/03/2026,18:29,17,160,93
AL12,London City Airport (UK),Charles de Gaulle Airport (France),1,22/11/2026,21:36,337,80,46
AM13,Aberdeen Airport (UK),Leonardo da Vinci International Airport (Italy),3,23/12/2026,19:25,42,240,139
AN14,East Midlands Airport (UK),Adolfo Suárez Madrid–Barajas Airport (Spain),2.5,24/03/2026,16:52,247,200,116
AO15,Cardiff Airport (UK),Schiphol Airport (Netherlands),4,05/11/2025,06:17,87,320,186
AP16,Belfast International Airport (UK),Murtala Muhammed International Airport (Nigeria),9,06/10/2026,11:06,226,720,418
AQ17,London Southend Airport (UK),Cairo International Airport (Egypt),6,16/02/2026,16:58,213,480,278
AR18,Inverness Airport (UK),O. R. Tambo International Airport (South Africa),12,30/11/2026,07:47,71,960,557
AS19,Doncaster Sheffield Airport (UK),São Paulo–Guarulhos International Airport (Brazil),14,01/11/2025,11:57,244,620,360
AT20,Southampton Airport (UK),Ministro Pistarini International Airport (Argentina),15,31/10/2026,22:45,133,700,406
AU21,Newcastle International Airport (UK),Comodoro Arturo Merino Benítez International Airport (Chile),14,16/11/2025,05:57,220,620,360
AV22,Manchester Ringway Airport (UK),John F. Kennedy International Airport (United States),11,27/05/2026,16:17,10,880,510
AW23,London Heathrow Terminal 5 (UK),Toronto Pearson International Airport (Canada),16,25/09/2026,17:39,20,780,452
AX24,Gatwick North Terminal (UK),Sydney Kingsford Smith Airport (Australia),24,15/03/2026,17:14,22,1420,824
BY01,Jinnah International Airport (Pakistan),Hong Kong International Airport (Hong Kong),7,21/03/2026,12:56,269,560,325
BZ02,Allama Iqbal International Airport (Pakistan),Changi Airport (Singapore),6,26/07/2026,16:56,207,480,278
BA03,Lahore International Airport (Pakistan),Indira Gandhi International Airport (India),2,13/09/2026,00:42,302,160,93
BB04,Islamabad International Airport (Pakistan),Soekarno-Hatta International Airport (Indonesia),6,09/03/2026,16:45,223,480,278
BC05,Peshawar Bacha Khan International Airport (Pakistan),Suvarnabhumi Airport (Thailand),7,02/03/2026,12:48,282,560,325
BD06,Sialkot International Airport (Pakistan),Kuala Lumpur International Airport (Malaysia),6,10/11/2025,03:03,4,480,278
BE07,Multan International Airport (Pakistan),Narita International Airport (Japan),7,11/11/2025,15:09,151,560,325
BF08,Faisalabad International Airport (Pakistan),Incheon International Airport (South Korea),7.5,23/03/2026,16:20,312,600,348
BG09,Quetta International Airport (Pakistan),Dubai International Airport (UAE),3,29/01/2027,04:28,98,240,139
BH10,Skardu Airport (Pakistan),Charles de Gaulle Airport (France),6,15/12/2025,11:54,348,480,278
BI11,Gwadar International Airport (Pakistan),Frankfurt Airport (Germany),5,29/09/2026,08:49,234,400,232
BJ12,Karachi International Airport (Pakistan),Leonardo da Vinci International Airport (Italy),5,16/11/2025,10:14,295,400,232
BK13,Rahim Yar Khan International Airport (Pakistan),Madrid-Barajas Airport (Spain),5.5,14/05/2026,20:35,1,440,255
BL14,Bahawalpur Airport (Pakistan),Schiphol Airport (Netherlands),4.5,09/11/2025,11:06,9,360,209
BM15,Dera Ismail Khan Airport (Pakistan),Zurich Airport (Switzerland),4,05/08/2026,03:07,89,320,186
BN16,Lahore Sialkot International Airport (Pakistan),O. R. Tambo International Airport (South Africa),7,14/05/2026,05:25,190,560,325
BO17,Islamabad Benazir Bhutto International Airport (Pakistan),Cairo International Airport (Egypt),5,13/08/2026,05:33,229,400,232
BP18,Rawalpindi International Airport (Pakistan),Murtala Muhammed International Airport (Nigeria),5.5,11/01/2026,13:34,95,440,255
BQ19,Khyber Pakhtunkhwa Airport (Pakistan),São Paulo-Guarulhos International Airport (Brazil),15,16/01/2026,19:07,300,700,406
BR20,Chitral Airport (Pakistan),Ministro Pistarini International Airport (Argentina),16,26/12/2025,03:50,12,780,452
BS21,Mirpur Airport (Pakistan),El Dorado International Airport (Colombia),14,01/07/2026,15:31,9,620,360
BT22,Swat Airport (Pakistan),John F. Kennedy International Airport (United States),20,24/05/2026,18:32,84,1100,638
BU23,Ziarat Airport (Pakistan),Toronto Pearson International Airport (Canada),22,25/04/2026,13:33,6,1260,731
BV24,Hala Airport (Pakistan),Sydney Kingsford Smith Airport (Australia),18,18/01/2027,08:21,205,940,545
CW01,Indira Gandhi International Airport (India),Jinnah International Airport (Pakistan),2,08/06/2026,13:28,232,160,93
CX02,Chhatrapati Shivaji Maharaj International Airport (India),Allama Iqbal International Airport (Pakistan),2,02/05/2026,23:15,321,160,93
CY03,Netaji Subhash Chandra Bose International Airport (India),Benazir Bhutto International Airport (Pakistan),2,28/08/2026,20:36,62,160,93
CZ04,Kempegowda International Airport (India),Faisalabad International Airport (Pakistan),2,21/10/2026,11:11,230,160,93
CA05,Rajiv Gandhi International Airport (India),Multan International Airport (Pakistan),2,10/01/2027,12:45,96,160,93
CB06,Chennai International Airport (India),Sialkot International Airport (Pakistan),2,23/03/2026,05:29,155,160,93
CC07,Sardar Vallabhbhai Patel International Airport (India),Quetta International Airport (Pakistan),2,26/02/2026,09:51,40,160,93
CD08,Pune International Airport (India),Peshawar Bacha Khan International Airport (Pakistan),2,26/09/2026,03:48,208,160,93
CE09,Cochin International Airport (India),Islamabad International Airport (Pakistan),2,17/11/2025,12:43,254,160,93
CF10,Goa International Airport (India),Karachi Port Trust Airport (Pakistan),2,05/07/2026,15:29,100,160,93
CG11,Jaipur International Airport (India),Skardu Airport (Pakistan),2,15/03/2026,17:20,93,160,93
CH12,Lucknow International Airport (India),Chitral Airport (Pakistan),2,17/03/2026,10:15,68,160,93
CI13,Ahmedabad Sardar Vallabhbhai Patel Airport (India),Tribhuvan International Airport (Nepal),1,23/01/2026,16:58,192,80,46
CJ14,Hyderabad Rajiv Gandhi Airport (India),Pokhara Airport (Nepal),1,29/05/2026,14:52,49,80,46
CK15,Bengaluru International Airport (India),Lukla Tenzing-Hillary Airport (Nepal),1,30/07/2026,22:58,61,80,46
CL16,Thiruvananthapuram International Airport (India),Bhairahawa Gautam Buddha International Airport (Nepal),1,08/04/2026,15:37,163,80,46
CM17,Vadodara Airport (India),Bandaranaike International Airport (Sri Lanka),1.5,19/04/2026,21:44,298,120,70
CN18,Surat International Airport (India),Mattala Rajapaksa International Airport (Sri Lanka),1.5,20/12/2026,21:30,235,120,70
CO19,Indore Devi Ahilya Bai Holkar Airport (India),Colombo Ratmalana Airport (Sri Lanka),1.5,11/05/2026,06:46,223,120,70
CP20,Madurai Airport (India),Jaffna International Airport (Sri Lanka),1.5,09/09/2026,15:23,81,120,70
CQ21,Visakhapatnam Airport (India),Mehrabad International Airport (Iran),3,26/12/2026,22:26,127,240,139
CR22,Nagpur Dr. Babasaheb Ambedkar International Airport (India),Tehran Imam Khomeini International Airport (Iran),3,21/01/2026,02:16,276,240,139
CS23,Mangalore International Airport (India),Shiraz International Airport (Iran),4,20/02/2026,22:16,46,320,186
CT24,Chandigarh International Airport (India),Isfahan International Airport (Iran),4,26/12/2026,23:00,68,320,186
DU01,Beijing Capital International Airport (China),Tabriz International Airport (Iran),4,15/06/2026,19:12,165,320,186
DV02,Shanghai Pudong International Airport (China),Mashhad International Airport (Iran),3,07/09/2026,02:36,141,240,139
DW03,Guangzhou Baiyun International Airport (China),Rasht International Airport (Iran),3,17/11/2026,17:47,245,240,139
DX04,Shenzhen Bao'an International Airport (China),Qeshm International Airport (Iran),3,25/06/2026,18:37,84,240,139
DY05,Chengdu Shuangliu International Airport (China),Nairobi Jomo Kenyatta International Airport (Kenya),10,31/12/2026,22:17,154,800,464
DZ06,Hong Kong International Airport (China),Mombasa Moi International Airport (Kenya),10,09/12/2025,11:28,175,800,464
DA07,Xi'an Xianyang International Airport (China),Kilimanjaro International Airport (Tanzania),10,10/04/2026,15:14,323,800,464
DB08,Kunming Changshui International Airport (China),Zanzibar International Airport (Tanzania),8,29/10/2026,12:19,93,640,371
DC09,Wuhan Tianhe International Airport (China),Entebbe International Airport (Uganda),12,25/01/2026,00:15,260,960,557
DD10,Chengdu Shuangliu International Airport (China),Kampala International Airport (Uganda),12,17/05/2026,07:28,347,960,557
DE11,Hangzhou Xiaoshan International Airport (China),Jinja Airport (Uganda),12,11/01/2026,07:54,82,960,557
DF12,Nanjing Lukou International Airport (China),Addis Ababa Bole International Airport (Ethiopia),12,24/05/2026,08:31,70,960,557
DG13,Dalian Zhoushuizi International Airport (China),Mekele Airport (Ethiopia),14,28/04/2026,14:16,164,620,360
DH14,Qingdao Liuting International Airport (China),Gonder Airport (Ethiopia),14,26/11/2026,23:41,273,620,360
DI15,Tianjin Binhai International Airport (China),Arba Minch Airport (Ethiopia),14,16/11/2026,18:07,259,620,360
DJ16,Changsha Huanghua International Airport (China),Accra Kotoka International Airport (Ghana),13,10/10/2026,19:46,301,540,313
DK17,Xi'an Xianyang International Airport (China),Kumasi International Airport (Ghana),13,02/10/2026,13:13,319,540,313
DL18,Fuzhou Changle International Airport (China),Takoradi Airport (Ghana),13,08/02/2026,09:13,273,540,313
DM19,Harbin Taiping International Airport (China),Felix-Houphouët-Boigny International Airport (Ivory Coast),11,24/07/2026,03:56,136,880,510
DN20,Chongqing Jiangbei International Airport (China),Bouaké Airport (Ivory Coast),11,28/04/2026,09:58,182,880,510
DO21,Xiamen Gaoqi International Airport (China),Yamoussoukro Airport (Ivory Coast),11,11/07/2026,22:48,82,880,510
DP22,Shenyang Taoxian International Airport (China),Incheon International Airport (South Korea),7,14/12/2026,08:54,168,560,325
DQ23,Haikou Meilan International Airport (China),Gimpo International Airport (South Korea),7,06/01/2026,21:23,321,560,325
DR24,Lijiang Sanyi Airport (China),Jeju International Airport (South Korea),7,07/09/2026,06:48,150,560,325
ES01,John F. Kennedy International Airport (USA),Busan Gimhae International Airport (South Korea),20,30/01/2026,03:39,328,1100,638
ET02,Los Angeles International Airport (USA),Daegu International Airport (South Korea),20,07/05/2026,04:59,298,1100,638
EU03,Chicago O'Hare International Airport (USA),Muan International Airport (South Korea),20,25/09/2026,13:37,170,1100,638
EV04,San Francisco International Airport (USA),Ninoy Aquino International Airport (Philippines),21,08/04/2026,06:23,336,1180,684
EW05,Denver International Airport (USA),Mactan-Cebu International Airport (Philippines),21,06/11/2025,06:07,298,1180,684
EX06,Seattle-Tacoma International Airport (USA),Davao International Airport (Philippines),21,15/06/2026,12:00,199,1180,684
EY07,Orlando International Airport (USA),Kalibo International Airport (Philippines),21,21/11/2026,08:39,345,1180,684
EZ08,Dallas/Fort Worth International Airport (USA),Iloilo International Airport (Philippines),21,14/03/2026,14:36,61,1180,684
EA09,Miami International Airport (USA),Zamboanga International Airport (Philippines),21,07/12/2025,19:23,2,1180,684
EB10,Atlanta Hartsfield-Jackson International Airport (USA),Yangon International Airport (Myanmar),15,17/06/2026,12:00,273,700,406
EC11,Boston Logan International Airport (USA),Mandalay International Airport (Myanmar),15,05/05/2026,19:56,252,700,406
ED12,Minneapolis-Saint Paul International Airport (USA),Naypyidaw International Airport (Myanmar),15,21/09/2026,18:28,323,700,406
EE13,Newark Liberty International Airport (USA),Heho Airport (Myanmar),15,03/01/2026,23:06,204,700,406
EF14,Charlotte Douglas International Airport (USA),Lashio Airport (Myanmar),15,17/05/2026,02:26,32,700,406
EG15,Phoenix Sky Harbor International Airport (USA),Bagan Nyaung U Airport (Myanmar),15,26/07/2026,15:11,156,700,406
EH16,Detroit Metropolitan Airport (USA),Phnom Penh International Airport (Cambodia),13,19/06/2026,13:59,115,540,313
EI17,Philadelphia International Airport (USA),Siem Reap International Airport (Cambodia),13,23/11/2025,04:32,212,540,313
EJ18,Washington Dulles International Airport (USA),Sihanoukville International Airport (Cambodia),13,12/01/2026,21:46,172,540,313
EK19,San Diego International Airport (USA),Battambang Airport (Cambodia),13,18/04/2026,12:08,338,540,313
EL20,Tampa International Airport (USA),Kep Airport (Cambodia),13,25/09/2026,16:34,131,540,313
EM21,Washington International Thurgood Marshall Airport (USA),Wattay International Airport (Laos),12.5,29/05/2026,03:17,264,1000,580
EN22,Salt Lake City International Airport (USA),Luang Prabang International Airport (Laos),12.5,27/10/2026,06:16,112,1000,580
EO23,Kansas City International Airport (USA),Pakse International Airport (Laos),12.5,30/08/2026,08:15,311,1000,580
EP24,St. Louis Lambert International Airport (USA),Savannakhet Airport (Laos),12.5,26/12/2025,09:34,182,1000,580
FQ01,Benito Juarez International Airport (Mexico),Xieng Khouang Airport (Laos),9.5,23/04/2026,02:41,142,760,441
FR02,Cancún International Airport (Mexico),Kuala Lumpur International Airport (Malaysia),11,30/01/2026,23:32,314,880,510
FS03,Monterrey International Airport (Mexico),Penang International Airport (Malaysia),11,18/04/2026,18:36,165,880,510
FT04,Guadalajara International Airport (Mexico),Langkawi International Airport (Malaysia),11,09/01/2026,00:31,259,880,510
FU05,Mérida International Airport (Mexico),Kota Kinabalu International Airport (Malaysia),11,27/04/2026,02:49,240,880,510
FV06,Puerto Vallarta International Airport (Mexico),Senai International Airport (Malaysia),11,09/09/2026,21:16,213,880,510
FW07,Tijuana International Airport (Mexico),Sultan Abdul Aziz Shah Airport (Malaysia),11,03/07/2026,15:11,3,880,510
FX08,León Bajío International Airport (Mexico),Tan Son Nhat International Airport (Vietnam),14,21/01/2027,04:39,339,620,360
FY09,Oaxaca International Airport (Mexico),Noi Bai International Airport (Vietnam),14,27/12/2026,15:56,90,620,360
FZ10,Hermosillo International Airport (Mexico),Da Nang International Airport (Vietnam),14,15/09/2026,01:42,38,620,360
FA11,San Luis Potosí International Airport (Mexico),Phu Quoc International Airport (Vietnam),14,14/02/2026,05:42,75,620,360
FB12,Veracruz General Heriberto Jara International Airport (Mexico),Dushanbe International Airport (Tajikistan),14,13/08/2026,22:14,184,620,360
FC13,Mazatlán International Airport (Mexico),Khujand International Airport (Tajikistan),14,09/11/2025,05:22,57,620,360
FD14,Aguascalientes International Airport (Mexico),Khorog Airport (Tajikistan),14,18/05/2026,05:35,235,620,360
FE15,Culiacán International Airport (Mexico),Paro International Airport (Bhutan),16,16/05/2026,01:35,339,780,452
FF16,La Paz International Airport (Mexico),Chennai International Airport (India),18,23/09/2026,07:20,58,940,545
FG17,Chihuahua International Airport (Mexico),Goa International Airport (India),18,11/10/2026,12:08,105,940,545
FH18,Torreón Francisco Sarabia International Airport (Mexico),Shirdi Airport (India),18,15/06/2026,12:19,169,940,545
FI19,Durango International Airport (Mexico),Rajiv Gandhi International Airport (India),18,04/08/2026,21:05,340,940,545
FJ20,Saltillo Airport (Mexico),Indira Gandhi International Airport (India),18,27/06/2026,22:10,4,940,545
FK21,Zacatecas General Leobardo C. Ruiz International Airport (Mexico),Kazakhstan International Airport (Kazakhstan),19.2,15/06/2026,02:10,257,1036,601
FL22,Monclova International Airport (Mexico),Astana International Airport (Kazakhstan),19.2,06/11/2026,07:38,167,1036,601
FM23,Acapulco International Airport (Mexico),Qatar International Airport (Qatar),17.3,23/02/2026,19:37,145,884,513
FN24,Sao Paulo–Guarulhos International Airport (Brazil),Doha Hamad International Airport (Qatar),12.2,18/01/2026,14:09,81,976,566
GO01,Rio de Janeiro–Galeão International Airport (Brazil),King Khalid International Airport (Saudi Arabia),10.4,18/01/2026,22:35,334,832,483
GP02,Brasilia International Airport (Brazil),Jeddah King Abdulaziz International Airport (Saudi Arabia),10.4,17/10/2026,09:45,325,832,483
GQ03,Tancredo Neves International Airport (Brazil),Prince Mohammad bin Abdulaziz International Airport (Saudi Arabia),10.4,14/11/2025,20:29,319,832,483
GR04,Ministro Pistarini International Airport (Brazil),Beirut Rafic Hariri International Airport (Lebanon),9.5,12/03/2026,15:47,292,760,441
GS05,Salvador Deputado Luís Eduardo Magalhães International Airport (Brazil),Queen Alia International Airport (Jordan),9.2,05/06/2026,21:51,90,736,427
GT06,Recife/Guararapes–Gilberto Freyre International Airport (Brazil),Muscat International Airport (Oman),10.5,03/02/2026,02:38,201,840,487
GU07,Fortaleza Pinto Martins – Fortaleza International Airport (Brazil),Kuwait International Airport (Kuwait),11.5,07/03/2026,12:11,155,920,534
GV08,Curitiba Afonso Pena International Airport (Brazil),Bahrain International Airport (Bahrain),12,19/01/2027,21:18,289,960,557
GW09,Manaus Eduardo Gomes International Airport (Brazil),Silvio Pettirossi International Airport (Paraguay),3.2,14/09/2026,19:27,347,256,148
GX10,Natal Augusto Severo International Airport (Brazil),Asunción Silvio Pettirossi International Airport (Paraguay),3.2,09/11/2025,02:40,57,256,148
GY11,Porto Alegre Salgado Filho International Airport (Brazil),Carlos Antonio López International Airport (Paraguay),3.2,28/08/2026,22:17,293,256,148
GZ12,Belem Val de Cans International Airport (Brazil),Simón Bolívar International Airport (Venezuela),2.5,17/01/2026,00:10,101,200,116
GA13,Campinas Viracopos International Airport (Brazil),Cumana Airport (Venezuela),2.5,05/08/2026,22:21,98,200,116
GB14,Cuiaba Marechal Rondon International Airport (Brazil),La Chinita International Airport (Venezuela),2.5,08/10/2026,11:20,137,200,116
GC15,Vitoria Eurico de Aguiar Salles Airport (Brazil),Boryspil International Airport (Ukraine),13.5,22/09/2026,19:26,341,580,336
GD16,Goiania Santa Genoveva International Airport (Brazil),Lviv Danylo Halytskyi International Airport (Ukraine),13.5,30/10/2026,04:57,242,580,336
GE17,Maceió Zumbi dos Palmares International Airport (Brazil),Odesa International Airport (Ukraine),13.5,24/12/2026,17:54,77,580,336
GF18,Joao Pessoa Presidente Castro Pinto International Airport (Brazil),Donetsk International Airport (Ukraine),13.5,31/07/2026,08:27,292,580,336
GG19,Santos Dumont Airport (Brazil),Kharkiv International Airport (Ukraine),13.5,14/05/2026,06:18,96,580,336
GH20,Cuiabá Marechal Rondon International Airport (Brazil),Simferopol International Airport (Ukraine),13.5,06/10/2026,08:18,112,580,336
GI21,Aracaju Santa Maria Airport (Brazil),Jinnah International Airport (Pakistan),15.3,27/07/2026,10:03,135,724,420
GJ22,Belo Horizonte Tancredo Neves International Airport (Brazil),Allama Iqbal International Airport (Pakistan),15.3,09/08/2026,18:30,333,724,420
GK23,El Dorado International Airport (Colombia),Benazir Bhutto International Airport (Pakistan),15.3,18/01/2026,00:29,84,724,420
GL24,José María Córdova International Airport (Colombia),Faisalabad International Airport (Pakistan),15.3,18/03/2026,07:52,17,724,420
HM01,Cartagena Rafael Núñez International Airport (Colombia),Multan International Airport (Pakistan),15.3,16/09/2026,19:21,122,724,420
HN02,Pereira Matecaña International Airport (Colombia),Sialkot International Airport (Pakistan),15.3,27/10/2026,15:03,81,724,420
HO03,Cali Alfonso Bonilla Aragón International Airport (Colombia),Quetta International Airport (Pakistan),15.3,10/04/2026,01:35,2,724,420
HP04,Barranquilla Ernesto Cortissoz International Airport (Colombia),Peshawar Bacha Khan International Airport (Pakistan),15.3,07/03/2026,09:25,9,724,420
HQ05,Medellin José María Córdova International Airport (Colombia),Islamabad International Airport (Pakistan),15.3,29/10/2026,01:46,182,724,420
HR06,Bucaramanga Palonegro International Airport (Colombia),Karachi Port Trust Airport (Pakistan),15.3,01/03/2026,13:38,130,724,420
HS07,Santa Marta Simón Bolívar International Airport (Colombia),Skardu Airport (Pakistan),15.3,05/12/2025,20:06,142,724,420
HT08,San Andrés Gustavo Rojas Pinilla International Airport (Colombia),Chitral Airport (Pakistan),15.3,17/11/2025,12:42,63,724,420
HU09,Pasto Antonio Nariño Airport (Colombia),Tribhuvan International Airport (Nepal),16.7,11/03/2026,13:47,326,836,485
HV10,Manizales La Nubia Airport (Colombia),Pokhara Airport (Nepal),16.7,12/10/2026,07:32,19,836,485
HW11,Armenia El Edén International Airport (Colombia),Lukla Tenzing-Hillary Airport (Nepal),16.7,17/05/2026,01:14,118,836,485
HX12,Neiva Benito Salas Airport (Colombia),Bhairahawa Gautam Buddha International Airport (Nepal),16.7,03/07/2026,13:37,22,836,485
HY13,Popayán Guillermo León Valencia Airport (Colombia),Bandaranaike International Airport (Sri Lanka),15.8,01/02/2026,06:12,294,764,443
HZ14,Quibdó El Caraño Airport (Colombia),Mattala Rajapaksa International Airport (Sri Lanka),15.8,20/09/2026,14:07,131,764,443
HA15,Tumaco La Florida Airport (Colombia),Colombo Ratmalana Airport (Sri Lanka),15.8,16/02/2026,00:28,82,764,443
HB16,Riohacha Almirante Padilla International Airport (Colombia),Jaffna International Airport (Sri Lanka),15.8,06/02/2026,06:39,130,764,443
HC17,Valledupar Alfonso López Michelsen International Airport (Colombia),Mehrabad International Airport (Iran),17.2,13/12/2026,09:00,287,876,508
HD18,Montería Los Garzones Airport (Colombia),Tehran Imam Khomeini International Airport (Iran),17.2,12/04/2026,01:52,271,876,508
HE19,Leticia Alfredo Vásquez Cobo International Airport (Colombia),Shiraz International Airport (Iran),17.2,05/01/2027,07:06,142,876,508
HF20,Paris Charles de Gaulle Airport (France),Isfahan International Airport (Iran),9.4,16/03/2026,18:46,245,752,436
HG21,Nice Côte d'Azur Airport (France),Tabriz International Airport (Iran),9.4,20/12/2025,15:44,111,752,436
HH22,Lyon-Saint-Exupéry Airport (France),Mashhad International Airport (Iran),9.4,29/10/2026,03:47,18,752,436
HI23,Marseille Provence Airport (France),Rasht International Airport (Iran),9.4,29/12/2026,21:49,30,752,436
HJ24,Toulouse-Blagnac Airport (France),Qeshm International Airport (Iran),9.4,15/01/2026,10:34,82,752,436
IK01,Bordeaux-Mérignac Airport (France),Nairobi Jomo Kenyatta International Airport (Kenya),7.5,06/11/2025,00:08,28,600,348
IL02,Nantes Atlantique Airport (France),Mombasa Moi International Airport (Kenya),7.5,18/01/2026,13:55,162,600,348
IM03,Lille Lesquin Airport (France),Kilimanjaro International Airport (Tanzania),8.5,12/01/2026,19:08,293,680,394
IN04,Strasbourg Airport (France),Zanzibar International Airport (Tanzania),8.5,02/03/2026,10:01,325,680,394
IO05,Montpellier Méditerranée Airport (France),Entebbe International Airport (Uganda),9.3,09/12/2025,15:52,241,744,432
IP06,Rennes Bretagne Airport (France),Kampala International Airport (Uganda),9.3,12/11/2026,13:08,162,744,432
IQ07,Brest Bretagne Airport (France),Jinja Airport (Uganda),9.3,10/01/2026,09:35,60,744,432
IR08,Lorient Bretagne Sud Airport (France),Addis Ababa Bole International Airport (Ethiopia),9.1,13/04/2026,09:19,243,728,422
IS09,Dijon Bourgogne Airport (France),Mekele Airport (Ethiopia),9.1,17/07/2026,18:58,235,728,422
IT10,Toulon-Hyères Airport (France),Gonder Airport (Ethiopia),9.1,01/04/2026,05:07,85,728,422
IU11,Ajaccio Napoleon Bonaparte Airport (France),Arba Minch Airport (Ethiopia),9.1,22/12/2026,22:58,281,728,422
IV12,Corsica Bastia Poretta Airport (France),Accra Kotoka International Airport (Ghana),9.7,25/08/2026,00:28,79,776,450
IW13,Perpignan-Rivesaltes Airport (France),Kumasi International Airport (Ghana),9.7,24/06/2026,14:18,229,776,450
IX14,Beauvais Tille Airport (France),Takoradi Airport (Ghana),9.7,25/12/2025,13:21,314,776,450
IY15,Clermont-Ferrand Auvergne Airport (France),Felix-Houphouët-Boigny International Airport (Ivory Coast),9.6,21/05/2026,09:44,94,768,445
IZ16,Chambery Airport (France),Bouaké Airport (Ivory Coast),9.6,04/08/2026,21:28,176,768,445
IA17,Saint-Étienne-Bouthéon Airport (France),Yamoussoukro Airport (Ivory Coast),9.6,17/11/2025,02:42,274,768,445
IB18,Mulhouse-Habsheim Airport (France),Incheon International Airport (South Korea),15.4,07/08/2026,20:17,168,732,425
IC19,Nouakchott International Airport (Mauritania),Gimpo International Airport (South Korea),17,21/01/2026,04:59,230,860,499
ID20,Murtala Muhammed International Airport (Nigeria),Jeju International Airport (South Korea),10,02/05/2026,04:32,213,800,464
IE21,Nnamdi Azikiwe International Airport (Nigeria),Busan Gimhae International Airport (South Korea),10,13/10/2026,05:58,203,800,464
IF22,Port Harcourt International Airport (Nigeria),Daegu International Airport (South Korea),10,12/11/2026,10:05,283,800,464
IG23,Akanu Ibiam International Airport (Nigeria),Muan International Airport (South Korea),10,04/04/2026,14:30,233,800,464
